{
  "analyzed_at_utc": "2026-07-25T11:17:33.367214Z",
  "checks": {
    "accepted_october_evidence_reproduced": true,
    "artifacts_verified_before_load": true,
    "fixed_threshold_grid_used": true,
    "october_counts_reconcile": true,
    "probabilities_finite_and_normalized": true,
    "september_accessed": false,
    "source_identity_reconciled": true,
    "test_accessed": false
  },
  "claims": {
    "deployment_authorized": false,
    "interpretation": "validation_only_abstention_policy_tuning",
    "portfolio_promotion_approved": false,
    "test_used_for_threshold_selection": false,
    "threshold_owner_approved": false,
    "threshold_proposed": false
  },
  "data": {
    "class_counts": {
      "Checking or savings account": 2614,
      "Credit card": 2652,
      "Credit reporting or other personal consumer reports": 27712,
      "Debt collection": 4683,
      "Debt or credit management": 129,
      "Money transfer, virtual currency, or money service": 902,
      "Mortgage": 1011,
      "Payday loan, title loan, personal loan, or advance loan": 491,
      "Prepaid card": 268,
      "Student loan": 725,
      "Vehicle loan or lease": 644
    },
    "evaluation_end_exclusive": "2024-11-01",
    "evaluation_split": "validation",
    "evaluation_start_inclusive": "2024-10-01",
    "labels": [
      "Checking or savings account",
      "Credit card",
      "Credit reporting or other personal consumer reports",
      "Debt collection",
      "Debt or credit management",
      "Money transfer, virtual currency, or money service",
      "Mortgage",
      "Payday loan, title loan, personal loan, or advance loan",
      "Prepaid card",
      "Student loan",
      "Vehicle loan or lease"
    ],
    "queried_splits": [
      "validation"
    ],
    "record_count": 41831,
    "september_accessed": false,
    "test_accessed": false
  },
  "limitations": [
    "october_was_used_for_prior_model_selection_and_calibration_assessment",
    "threshold_results_are_validation_tuning_evidence",
    "one_global_threshold_may_affect_classes_differently",
    "wilson_intervals_do_not_cover_distribution_shift_or_label_error",
    "operational_slices_are_not_demographic_fairness_evidence",
    "reviewer_productivity_and_downstream_harm_are_not_measured",
    "frozen_test_remains_untouched"
  ],
  "policy": {
    "adr": "docs/decisions/0016-proposed-abstention-and-final-evaluation-policy.md",
    "candidate_thresholds": [
      0.5,
      0.55,
      0.6,
      0.65,
      0.7,
      0.75,
      0.8,
      0.85,
      0.9,
      0.95
    ],
    "comparison_operator": "confidence_greater_than_or_equal_to_threshold",
    "no_eligible_candidate_fallback": "manual_review_only",
    "reference_threshold": 0.0,
    "requirements": {
      "maximum_false_suggestion_rate": 0.05,
      "minimum_actual_class_coverage": 0.1,
      "minimum_coverage": 0.6,
      "minimum_predicted_class_precision": 0.5,
      "minimum_predicted_class_suggestions": 20,
      "minimum_selective_accuracy": 0.93
    },
    "selection_order": [
      "highest_global_coverage",
      "highest_global_selective_accuracy",
      "lowest_false_suggestion_rate",
      "lower_threshold"
    ]
  },
  "privacy": {
    "contains_complaint_ids": false,
    "contains_narratives": false,
    "contains_row_logits": false,
    "contains_row_predictions": false,
    "contains_row_probabilities": false,
    "contains_row_threshold_outcomes": false,
    "contains_row_values": false,
    "contains_token_ids": false,
    "report_git_tracking_allowed": true
  },
  "report_version": "abstention-threshold-analysis-1.0.0",
  "reproduction": {
    "absolute_tolerance": 1e-05,
    "accepted_metrics": {
      "accuracy": 0.882120915110803,
      "multiclass_brier_loss": 0.17705330414992662,
      "negative_log_likelihood": 0.3698036697339236,
      "record_count": 41831
    },
    "checks": {
      "accuracy_matches": true,
      "multiclass_brier_loss_matches": true,
      "negative_log_likelihood_matches": true,
      "record_count_matches": true
    },
    "observed_metrics": {
      "accuracy": 0.882120915110803,
      "multiclass_brier_loss": 0.17705310499500027,
      "negative_log_likelihood": 0.36980385224368734,
      "record_count": 41831
    }
  },
  "run_id": "cfpb-run-20260722T130728Z-2b7815d4c850",
  "runtime": {
    "gpu_inference_seconds": 55.787,
    "peak_cuda_bytes": 240355840
  },
  "selection": {
    "eligible_candidate_count": 0,
    "failed_gates_by_threshold": {
      "0.50": [
        "selective_accuracy_at_least_0p93",
        "false_suggestion_rate_at_most_0p05",
        "every_predicted_class_precision_at_least_0p50"
      ],
      "0.55": [
        "selective_accuracy_at_least_0p93",
        "false_suggestion_rate_at_most_0p05"
      ],
      "0.60": [
        "selective_accuracy_at_least_0p93",
        "false_suggestion_rate_at_most_0p05"
      ],
      "0.65": [
        "selective_accuracy_at_least_0p93",
        "false_suggestion_rate_at_most_0p05"
      ],
      "0.70": [
        "selective_accuracy_at_least_0p93",
        "false_suggestion_rate_at_most_0p05",
        "every_predicted_class_has_at_least_20_suggestions"
      ],
      "0.75": [
        "false_suggestion_rate_at_most_0p05",
        "every_predicted_class_has_at_least_20_suggestions"
      ],
      "0.80": [
        "every_predicted_class_has_at_least_20_suggestions",
        "every_predicted_class_precision_at_least_0p50"
      ],
      "0.85": [
        "every_predicted_class_has_at_least_20_suggestions",
        "every_predicted_class_precision_at_least_0p50"
      ],
      "0.90": [
        "every_predicted_class_has_at_least_20_suggestions",
        "every_predicted_class_precision_at_least_0p50"
      ],
      "0.95": [
        "coverage_at_least_0p60",
        "every_actual_class_coverage_at_least_0p10",
        "every_predicted_class_has_at_least_20_suggestions",
        "every_predicted_class_precision_at_least_0p50"
      ]
    },
    "next_gate": "review_policy_failure_before_any_new_proposal",
    "proposed_threshold": null,
    "selected_threshold_owner_approved": false,
    "status": "manual_review_only"
  },
  "software": {
    "numpy": "2.5.1",
    "python": "3.12.10",
    "safetensors": "0.8.0",
    "torch": "2.13.0+cu130",
    "transformers": "5.14.1"
  },
  "source": {
    "analysis_implementation_commit_sha": "6866ee17242534d23a7dd1350092a420662b6c78",
    "calibration_report_sha256": "faa1125b99e5dbc9421628102b21e330940700952bbc501bee2cd2bdc46e655e",
    "calibrator_artifact_sha256": "3fc439322d7bc32d7f0bfbdef6f5383bfc0867e595bad340340aba9909a66800",
    "model_artifact_sha256": "c83f4ad8c225dea2a8b32424d9af6179ee028dc6adf6bc1eeea9f18932325415",
    "model_selection_report_sha256": "e4ca24d08a327f2336c006777774142d3b32d120170c50d81ab01dbde54748a7",
    "split_manifest_sha256": "8685eefd10d764d813dee2891e930323c22592850d537b0571956f390afe554b",
    "transformer_report_sha256": "b55188c31a9d28d0eaa424a1208578a9454368098cc803d3aebb87f8a2bd8cef"
  },
  "thresholds": [
    {
      "actual_classes": [
        {
          "conditional_accuracy": 0.8393267023718439,
          "correct_suggestion_count": 2194,
          "coverage": 1.0,
          "label": "Checking or savings account",
          "suggested_count": 2614,
          "support": 2614
        },
        {
          "conditional_accuracy": 0.7963800904977375,
          "correct_suggestion_count": 2112,
          "coverage": 1.0,
          "label": "Credit card",
          "suggested_count": 2652,
          "support": 2652
        },
        {
          "conditional_accuracy": 0.9319789260969977,
          "correct_suggestion_count": 25827,
          "coverage": 1.0,
          "label": "Credit reporting or other personal consumer reports",
          "suggested_count": 27712,
          "support": 27712
        },
        {
          "conditional_accuracy": 0.757847533632287,
          "correct_suggestion_count": 3549,
          "coverage": 1.0,
          "label": "Debt collection",
          "suggested_count": 4683,
          "support": 4683
        },
        {
          "conditional_accuracy": 0.17829457364341086,
          "correct_suggestion_count": 23,
          "coverage": 1.0,
          "label": "Debt or credit management",
          "suggested_count": 129,
          "support": 129
        },
        {
          "conditional_accuracy": 0.7062084257206208,
          "correct_suggestion_count": 637,
          "coverage": 1.0,
          "label": "Money transfer, virtual currency, or money service",
          "suggested_count": 902,
          "support": 902
        },
        {
          "conditional_accuracy": 0.9169139465875371,
          "correct_suggestion_count": 927,
          "coverage": 1.0,
          "label": "Mortgage",
          "suggested_count": 1011,
          "support": 1011
        },
        {
          "conditional_accuracy": 0.6313645621181263,
          "correct_suggestion_count": 310,
          "coverage": 1.0,
          "label": "Payday loan, title loan, personal loan, or advance loan",
          "suggested_count": 491,
          "support": 491
        },
        {
          "conditional_accuracy": 0.7089552238805971,
          "correct_suggestion_count": 190,
          "coverage": 1.0,
          "label": "Prepaid card",
          "suggested_count": 268,
          "support": 268
        },
        {
          "conditional_accuracy": 0.8855172413793103,
          "correct_suggestion_count": 642,
          "coverage": 1.0,
          "label": "Student loan",
          "suggested_count": 725,
          "support": 725
        },
        {
          "conditional_accuracy": 0.7593167701863354,
          "correct_suggestion_count": 489,
          "coverage": 1.0,
          "label": "Vehicle loan or lease",
          "suggested_count": 644,
          "support": 644
        }
      ],
      "checks": {
        "candidate_threshold": false,
        "coverage_at_least_0p60": true,